Reviewer_Name,Review_Body,Review_Date,Rating,Country,Helpful_Tag,Travel Category,Require_Translate
Anonymous,There are no comments available for this review,2024-03-16,1,,,,False
claude,"Prendre à l'avance un citoyen pass et un abonnement vaporetto, avoir un petit guide avec plan de Venise et des arrêts vaporetto...et puis se regaler",2024-03-15,5,France,Helpful,solo,True
Birgit,"Ein Highlight unserer Urlaubswoche in Venedig. Tolle Musiker, erste Violine war fantastisch. Wir waren begeistert und mit uns fast alle Besucher. Es gab Standing Ovations!!!",2024-03-15,5,Germany,Helpful,a partner or spouse,True
Sharon,There are no comments available for this review,2024-03-15,4,Ireland,,friends,False
Anonymous,There are no comments available for this review,2024-03-14,5,,,,False
Christoph,There are no comments available for this review,2024-03-13,5,Germany,,a partner or spouse,False
Anonymous,There are no comments available for this review,2024-03-13,5,,,,False
pelloux,Pour une première ce fut un moment merveilleux dans un endroit somptueux Nous ne regrettons pas notre choix du premier rang pour une expérience encore plus forte … à faire sans modération,2024-03-12,5,France,Helpful,a partner or spouse,True
Sara,Stunning virtuoso playing!!,2024-03-12,5,United Kingdom,Helpful,a partner or spouse,False
Egle,"Easy to find, tickets and the concert are both in church at the main canal just 4 min from St Marco plaza. The music was performed beautifully, a must experience.",2024-03-12,5,Lithuania,Helpful,friends,False
Anonymous,There are no comments available for this review,2024-03-11,5,,,,False
Niewiarowski,"Top!! Poezja dla ucha i duszy. Coś pięknego, polecam każdemu!",2024-03-11,5,,Helpful,a partner or spouse,True
Guillaume,"Très bien placé. Ensemble avec 3 violons, 1 Alto, 1 violoncelle, une contrebasse et un clavecin. 3 morceaux avant les 4 saisons avec un violoncelliste soliste en plus. Très beau.",2024-03-11,5,France,Helpful,a partner or spouse,True
Burak,There are no comments available for this review,2024-03-11,5,Germany,,a partner or spouse,False
Isabelle,There are no comments available for this review,2024-03-11,5,France,,a partner or spouse,False
Anonymous,There are no comments available for this review,2024-03-11,4,,,,False
David,Es una esperiencia que no se debe perder. Excelente,2024-03-11,5,Spain,Helpful,a partner or spouse,True
Laurent,Très bon moment. Une parenthèse sympa pour encore mieux découvrir Venise,2024-03-10,5,France,Helpful,a partner or spouse,True
Angelique,Formidable,2024-03-09,5,France,Helpful,solo,True
Anonymous,There are no comments available for this review,2024-03-07,5,,,,False
Jitka,"Nádherný koncert na krásném místě, vyzvednutí lístku velmi snadné.",2024-03-07,5,Czech Republic,Helpful,family,True
Olga,There are no comments available for this review,2024-03-07,5,France,,family,False
Catriona,Fantastic concert- a lovely experience!,2024-03-06,5,United Kingdom,Helpful,a partner or spouse,False
Melih,There are no comments available for this review,2024-03-06,5,Turkey,,solo,False
Patricia,"If you have a chance to see this and you enjoy classical music, then it will be worth your while. It was truly beautiful.",2024-03-05,5,United States,Helpful,friends,False
Anonymous,Fantastic experience 👍,2024-03-05,5,,Helpful,friends,False
Ágnes,There are no comments available for this review,2024-03-04,5,Hungary,,solo,False
Anonymous,There are no comments available for this review,2024-03-03,5,,,,False
Vyara_I,"The experience was surreal and I can definetely say that the audience was completely mesmerized by the magical music. The orchestra, the acoustics and the whole atmosphere still gives me the chills. I would recommend 100%.",2024-03-03,5,,Helpful,,False
Christophe,"Très bonne organisation Déçu par le concert. En une heure pile, le concert était terminé et pour cause ! Tous les tempi étaient trop rapides. À croire que le 1er violon avait une pizza sur le feu. Ce concert relevait plus d’un exercice de virtuosité de sa part. Le seul instant paisible, reposant, était le 2ème mouvement de l’automne (il ne jouait pas ). Le canon de Pachelbel, je ne l’ai jamais entendu aussi vite. Au fur et à mesure, ça accélérait, ça accélérait… En plus, le violoncelliste plante une fausse note dès le début de son intervention. Bravo. Bref, pas si mal mais on avait envie de leur dire, « hé les gars, respirerez, détendez vous ! ». En tout cas, ce n’était pas apaisant comme concert.",2024-03-02,3,France,Helpful,family,True
Carolyne,Best thing I saw in Venice Highly recommend The boat bus stops almost in front of church Don't miss this if you love music or,2024-03-01,5,Italy,Helpful,solo,False
Karen_B,"I love Vivaldi's work and I make it a point to go to a Vivaldi Concert every time I visit Venice.  This is the first one I have been to in this particular location and it was excellent.  The musicians are very talented.  Listening to the Four Seasons in Vivaldi's ""church"" was a great experience.  Even my 43 year old son who grudgingly attended with me (not a fan of Classical music) said at the end, ""this was not bad and I even enjoyed it.""  High praise indeed.  I would highly recommend this concert and this venue.",2024-03-01,5,,Helpful,,False
Jungwoo,베니스에서 할 수 있는 최고의 경험입니다. 비발디가 봉직했던 바로 그 성당에서 수준급 연주자들이 연주하는 사계를 듣는다니! 세상에 이보다 더 멋진 경험이 있을까요? 이렇게 자렴한 가격으로요,2024-02-27,5,South Korea,Helpful,family,True
Paula  Inês,"Booked it on the day of the concert (which is amazing tbh), the check-in was super fast however the instructions to pick up the tickets were a bit misleading (it was way simpler than the site made it to be). The seats were super uncomfortable (but I guess that's what you get from a church..). The rest went on flawless ( but the public could use some classical music studying.. you do not clap middle performance)",2024-02-27,4,,Helpful,a partner or spouse,False
James,"This has to be one of the best value activities I've ever experienced. Myself and my family were blown away by the quality of these musicians. To hear the work of Vivaldi played in the beautiful church where he worked is something I will never forget. I paid extra to sit in the front two rows. It was breathtaking, emotional and beautiful. I cannot recommend this enough. You should make this a must do if you are visiting Venice. Outstanding.",2024-02-26,5,United States,Helpful,family,False
Maria_K,Everything was memorable. The Four Seasons  could not have been a better  piece for this amazing church. The lead violin and conductor was outstanding.,2024-02-26,5,,Helpful,,False
Katy_M,Absolutely excellent. So happy we got to experience such a magical performance. It was made even nicer when we had a last minute emergency and these guys accommodated our coming the next evening instead. Just so wonderful. We're so happy we didn't miss it!,2024-02-26,5,,Helpful,,False
Tatjana,There are no comments available for this review,2024-02-26,5,Estonia,,family,False
Heidi_C,Wow! Such talented musicians played the best of Vivaldi. It was beautiful to see how much the first violinist was enjoying himself. The amount of practice they must do is evident in the level of their performance.  The length of the concert was perfect. We all enjoyed it very much!,2024-02-26,5,,Helpful,,False
Domen,There are no comments available for this review,2024-02-25,5,Slovenia,,family,False
linig,What great concert. Viator booking made this so easy. Good direction efficient ticket collection on entry. Intimate venue and comfy seats.,2024-02-25,5,,Helpful,,False
christel_c,"Superbe. 
Un magnifique temps musical.
Impeccable organisation et beau lieu.
Musiciens de qualité.
Au cœur de Venise.",2024-02-22,5,,Helpful,,True
NIkka_V,"Hearing Vivaldi's ""The Four Seasons"" in the church where he composed it was beautiful.  Even if you are not a classical music fan, this is an experience you won't regret.",2024-02-21,5,,Helpful,,False
Kevin_L,Very talented performers and short enough for non music lovers to appreciate without feeling time is dragging.,2024-02-19,5,,Helpful,,False
Ashleigh,"Absolutely amazing experience, I thoroughly recommend it. It’s cheaper on the door, but sells out quickly, so was better to book online. The church doesn’t open until 10.45am so redeeming tickets took us some time as there was no notice on the outside to say we were in the right place! Other than that, once we it was open, our tickets were ready for us!",2024-02-19,5,United Kingdom,Helpful,family,False
Ella,Fantastic event. Once in a life time & so glad we did it,2024-02-17,5,United Kingdom,Helpful,a partner or spouse,False
Andrea,This is a very beautiful venue in a former church where Vivaldi used to attend. It was a wonderful selection of music including the 4 seasons that lasted just over an hour. I highly recommend this performance.,2024-02-14,5,United States,Helpful,friends,False
George,Superb,2024-02-13,5,Luxembourg,Helpful,friends,False
Irina Roxana,There are no comments available for this review,2024-02-13,5,Romania,,family,False
Steven,Beautiful venue in church. Music was outstanding.,2024-02-11,5,United States,Helpful,a partner or spouse,False
Anonymous,There are no comments available for this review,2024-02-11,4,,,,False
Anonymous,There are no comments available for this review,2024-02-10,5,,,,False
Chris,Absolutely incredible performance. I can’t recommend this enough!,2024-02-10,5,United Kingdom,Helpful,solo,False
Anonymous,There are no comments available for this review,2024-02-07,4,,,,False
Sue_R,"The performers were excellent. The energy and musicianship was exceptional. I thought they might be stale (assuming they've played the same music hundreds--if not thousands--of times), but the entire concert was very well done.",2024-02-07,5,,Helpful,,False
Simon_B,"Fantastic music in gorgeous surroundings.
Beautifully played - the lead violin was exceptional & the ensemble supported brilliantly.",2024-02-06,5,,Helpful,,False
arnaud_b,"moment remarquable ! 1 heure de bonheur musical, tout est parfait 
mais attention, bien se couvrir car l'Eglise est vraiment froide :)",2024-02-05,5,,Helpful,,True
Louisa,"Excellent concert, good quality musicianship and an atmospheric (if very cold inside the Church - on a very foggy night in January) venue. Short and sweet, very glad we went!",2024-01-29,5,United Kingdom,Helpful,family,False
Magdalena,"It was amazing, truly magical experience and the staff were very helpful.",2024-01-25,5,Ireland,Helpful,friends,False
Gerry,"Booked this event just two weeks in advance, and whilst the church was full, what a setting. The ensemble were fantastic. The event lasted just over an hour and for a weekend break it did not take up a whole evening. Highly recommended.",2024-01-15,5,United Kingdom,Helpful,a partner or spouse,False
Lorenzo,There are no comments available for this review,2024-01-15,5,Luxembourg,,solo,False
David,There are no comments available for this review,2024-01-13,4,United States,,friends,False
Thomas,There are no comments available for this review,2024-01-13,5,New Zealand,,a partner or spouse,False
Ercilia_L,"Prima di tutto noi abbiamo posti numerati, più giusto con quelli che hanno compratto di prima.
Poi la chiesa è belissima e la scenografia con le luce è belissima.
Por fine - ed il più importante - la orchestra di camera è buonissima.
E da non dimenticare.... li se presentava ed/o ha composto il proprio genio de la musica barroca!!",2024-01-12,5,,Helpful,,True
Stacy,There are no comments available for this review,2024-01-10,5,United States,,a partner or spouse,False
Lauren,A masterful performance and stunning venue!,2024-01-10,5,United Kingdom,Helpful,solo,False
JeanPierre_H,"La double billetterie est inacceptable et perturbante. La soirée en aura été gâchée. Dommage pour nous autant que pour l’organisation,  disons... fantaisiste !",2024-01-10,3,,Helpful,,True
Elaine,There are no comments available for this review,2024-01-09,5,Ireland,,a partner or spouse,False
Fabiola,"Great performance and amazing male staff member,who helped us sorry we don't know a name. Thank you for great memories. Grazie mille.Fabiola&Adam",2024-01-08,5,United Kingdom,Helpful,a partner or spouse,True
Theresa_R,"Musicians were incredible and brought Vivaldi to life in ""his"" church. Highly recommend. I really like that the first songs before the Four Seasons were also by Vivaldi.  Too often you just hear other classics.",2024-01-08,5,,Helpful,,False
Alex,There are no comments available for this review,2024-01-08,5,,,friends,False
Catriona_M,"Hell really is other people. The music was good, sometimes great. Unfortunately the experience was marred by many people holding phones up to film the musicians throughout, and by being sat beside someone coughing, fidgeting, talking (!), and being on their phone throughout event. The venue may want to ask people to be respectful of performance, or ask for photos only at end (make announcement at start,?).  As hope for people to not turn up sick. I would go again but with expectations managed.",2024-01-07,3,,Helpful,,False
Virginie_G,"Un moment magique, très apaisant et nous emportant ailleurs. Musiciens au top, très belle acoustique. A faire.",2024-01-07,5,,Helpful,,True
Michael_B,"Was an amazing performance by the musicians in a beautiful and historic venue. I would highly recommend this to anyone going to Venice, particularly if you have a hour to spare.",2024-01-06,5,,Helpful,,False
Pamela_L,"Great location, small and intimate venue so everyone can enjoy the beautiful music. Wonderful acoustics in Vivaldi church.",2024-01-06,5,,Helpful,,False
Emily_B,"One of the highlights of my trip to Venice, the church is just beautiful and the musicians were spectacular, well worth booking",2024-01-03,5,,Helpful,,False
Dee,"great ambiance, performance and music. must do in venice where Vivaldi wrote. booking viator was smooth",2024-01-03,5,,Helpful,,False
Yvonne_B,"Wirklich zu empfehlen! Tolles Ambiente, gemütlicher Rahmen und tolle emotionale Musiker. Ein gelungener Abend.",2024-01-03,5,,Helpful,,True
Carolyn_C,There’s just some thing about hearing a concert by composer in the church that it was composed in. The concert was lovely and the performers did a great job. It was super simple to print out our tickets and show them to the people at the door and find our seats. Definitely worth the visit!,2024-01-02,5,,Helpful,,False
Eunice_O,It was a joy listening to Vivaldi's Four Seasons in the very church where he was at. The passion and love the musicians have for music is contagious! Bravo!,2024-01-02,5,,Helpful,,False
Sarah_C,This was an event that I cannot recommend enough. The church itself is beautiful and the musicians were amazing. Don’t miss the opportunity,2023-12-22,5,,Helpful,,False
Juan_R,Todo fue bien. La reserva rápida y sin incidencias. La iglesia preciosa y la música perfecta.  Emociona escuchar a Vivaldi en su propia casa,2023-12-17,5,,Helpful,,True
Charlie_C, Very entertaining and a great show. Would highly recommend for anyone to enjoy. It was a great last minute choice.,2023-12-14,5,,Helpful,,False
Kristen_B,This was one of the highlights of our trip!!  My husband is a violinist and we marvel at the skills  of the musicians and how they memorize the entire show! This is a must do for anyone visiting Venice!!,2023-12-10,5,,Helpful,,False
Ana_C,"Seriously this was the highlight of our Venezia trip and probably top activity we have done on any of our trips. We love music, and enjoying it at Vivaldi’s church has been amazing. Musicians were extremely passionate when performing and we could feel their energy through the music.
Definitely book this experience 10/10!",2023-12-10,5,,Helpful,,False
Dawn_V,Make the time to visit Vivaldi’s church to listen to his masterpiece.  You will not regret it! Absolutely amazing experience!,2023-12-04,5,,Helpful,,False
Graciela_C,"Wonderful experience! Excellent and very professional musicians, lovely venue with perfect back story to complement the concert, and easy/fast access.",2023-12-03,5,,Helpful,,False
Paola_C,"Bella esperienza, il concerto dura un’ora e un quarto, vale la pena anche per il contesto della chiesa con bell’affresco del Tiepolo.",2023-12-02,5,,Helpful,,True
Joshua_D,"You enter this beautiful church, are quickly and efficiently checked in and given a program.  They will help you find your seat if necessary.  When the time comes, the orchestra comes out - a hush falls over the crowd. And without an introduction, long speech welcoming you, or any trite intoduction, they start playing.  While we both like Vivaldi, my wife loves Vivaldi's Four Seasons and I think I might have seen a tear or two and a non-stop smile on her face.  The head violinist took a few liberties when it comes to timing, but you were never mad about it. I think it was to showcase his skill.  They spirinkled in some Canon in D and a few other songs that were beautiful as well.  Just a wonderful hour and a great way to start or end an evening.",2023-12-01,5,,Helpful,,False
Sara_D,Though the concert was amazing we were more than a little upset to pay 30 euros over the ticket price for using Viator. Check out prices prior to using this company.,2023-11-26,3,,Helpful,,False
Nichola_K,The musicians were world class and the evening memorable . Vivaldi's Church was the perfect setting and the lighting expertly done to reflect the seasons.  Just fabulous!,2023-11-24,5,,Helpful,,False
Andy_H,"Really enjoyed the performance, the lead violin was superb, the whole ensemble were great musicians.",2023-11-22,5,,Helpful,,False
Arthur_P,"The Vivaldi Concert was wonderful! The setting in, what is called the Vivaldi Church, is beautiful with excellent acoustics. The musicians were fantastic. This is a must see in Venice!",2023-11-21,5,,Helpful,,False
Elliot_B,"To be in the church where Antonio Vivaldi composed some of his early works and served as the music director would have been amazing enough, but to listen to an exceptional Quartet perform ""The Four Seasons"" in the church, complete with special lighting was one of the most remarkable concert experiences my wife and I have ever had.  We would HIGHLY recommend this experience to any fan of Vivaldi and/or Classical music!",2023-11-21,5,,Helpful,,False
Sarah_T,"Best thing ever!!!! Of all the different things we did in Venice this was just fabulous.
Glauco Bertagnin was the lead violinist and was a supreme maestro.",2023-11-16,5,,Helpful,,False
Karen_S,I cannot express in mere words the experience of listening to Vivaldi in the same place where his music came alive 300 years ago. It was well worth the money.,2023-11-13,5,,Helpful,,False
Soumya_B,The atmosphere was beautiful. The church an ideal setting for the performance. It was eclectic . I recommend this experience for all visitors to Venice.,2023-11-12,4,,Helpful,,False
Jeanette_C,The musicians were excellent and provided a great concert.  The church is beautiful and provides a great backdrop for the performers.  The venue is conveniently located near San Marco Square.  The only negative is that there are no washrooms available.,2023-11-10,5,,Helpful,,False
Jason_T,"A wonderful performance by all involved, especially the lead violinist. Such passion was shown by him. The seats were a little uncomfortable however",2023-11-08,5,,Helpful,,False
Calvin_J,"Beautiful venue, wonderful performers. Have dinner nearby then head over to the show, a great experience for all ages when visiting Venice.",2023-11-08,5,,Helpful,,False
Sharron_S,Being in the  church where Vivaldi prayed made it special . It was well performed in a phenomenal environment.,2023-11-08,5,,Helpful,,False
Aaron_N,The haunting violin sounds -especially the frist violinist who enjoyed himself as much as the audience,2023-11-05,5,,Helpful,,False
Catherine_V,"Belle expérience avec mes enfants (10 et 14 ans). 1h de concert, juste ce qu il fallait. Les musiciens sont imprégnés par la musique.",2023-10-31,4,,Helpful,,True
Myrna_C,"I am originally from NYC and with that said have gone to the Met...this is NOT to be missed. Exhilarating, spectacular and the overall fact that its done in a church....the acoustics is astonishing...will not disappoint.",2023-10-30,5,,Helpful,,False
Alex_L,"Excellent. Nice way to spend an evening followed
By a delightful stroll amongst the tacky tourist stalls and amazing waterfront.",2023-10-29,5,,Helpful,,False
JeanetteCooper_H,"Simply exquisite performance in an equally extraordinary setting. This concert was full of surprises in both the interpretation of well known pieces and the exuberant energy of the performers. We were mesmerized the entire performance, even our teenagers.",2023-10-27,5,,Helpful,,False
Shannon_C,"This was an amazing experience! A wonderful performance of Vivaldi's Four Seasons, with coloured accent lighting behind the performers as they move between seasons. We were assigned great seats (we'd booked early!) and really enjoyed the show. The location was great - Vivaldi's church is very close to lots of shops and restaurants. We walked through Venice and took the bus to Maestro, but you can also hop on a boat right outside the church.",2023-10-19,5,,Helpful,,False
natacha_m,"Très bel endroit pour écouter du Vivaldi, le son aurait pu être plus fort, impression lointain. Nous avons passé un moment agréable.",2023-10-15,4,,Helpful,,True
Emily_W,"Beautiful and rousing concert in a stunning location. Easy collection of tickets, a perfect and relaxing evening in Venice",2023-10-12,5,,Helpful,,False
Ken_M,"For someone who loves the Four Seasons as much as I do, as someone who listened to it every day after school while doing my homework, this was a big disappointment.  The hall swallowed up much of the sound so that the Handel and Bach appetizers seemed to consist of a double bass with a whispery violin on melody.  For me the driving cantabile pulse seemed missing from most of the Vivaldi and we both felt the concertmaster considered he was doing us a favour to let us hear him. One evidence is the way many passages were rushed as if to show how clever the musicians are instead of letting me sing with the tender parts and triumph in the high energy pulses.  From reading other reviews. I see I'm the odd man out.  It was performed in a stunning venue and you'll probably enjoy it.  Remember there are three different ensembles playing the Quattro Stagiones almost every day in Venice.",2023-10-09,2,,Helpful,,False
Sandra_G,"Beautiful experience. Highly recommended. Beautiful church, chairs a bit uncomfortable but lasts an hour so your bum will survive this. After that went for dinner at a restaurant nearby.",2023-10-09,5,,Helpful,,False
timothy_b,"A lovely experience made all the better for being held in a attractive venue. The musicians were excellent and showed their love of the music they were playing.
A great introduction to Venice.",2023-10-05,5,,Helpful,,False
Barb_L,A beautiful performance that embodies Vivaldis’ masterpiece. A great way to start the evening ! For the music lover and the music novice!,2023-10-02,5,,Helpful,,False
dungeon40yahoocouk,"What an experience!
What a concert and how good was the violinists.
A brilliant performance a excellent and lovely setting and a great experience.
Wish we could have done it again!!",2023-10-02,5,,Helpful,,False
Mac_J,Amazing performance!! Highly recommended. You will not go wrong with choosing this as something to do while in Venice. Plus you can get a great bite to eat afterwards!,2023-10-01,5,,Helpful,,False
Michael_W,The musicians enjoyed performing as much as I enjoyed listening and watching. The venue was beautiful.,2023-09-28,5,,Helpful,,False
Donald_L,"Great way to see live music, played by professionals with emotion and skill, in a beautiful location. Just a short walk from St. Mark's, right on the water.",2023-09-27,5,,Helpful,,False
cathmodlik,Wonderful concert. Thoroughly recommend. I'm not big on this genre but we loved this concert. Extraordinary talent - worth every cent. Bravo And thank you,2023-09-24,5,,Helpful,,False
Joan_H,"Unforgettable night. Highly recommend. The location was great. Atmosphere was magical. Staffing and check in service was one of the most easiest process ever. All I did was show them my email and tickets were given to me within seconds. Concert was magical, best 1 hour.",2023-09-21,5,,Helpful,,False
Linda_K,"The concert was magical!  Wonderful rendition of Vivaldi's Four Seasons in a beautiful Baroque church where the composer worked and played.  As an encore, the ensemble played a part of a Vivaldi concerto with so much feeling that they had many of us in tears.  A wonderful evening!",2023-09-21,5,,Helpful,,False
Doug_L,The Concert is a wonderful experience when in Venice! The setting is unique and the group of musicians are so talented. We highly recommend.,2023-09-20,5,,Helpful,,False
David_R,"Outstanding. Excellent concert by fine musicians in a marvellous venue. We had to change the date at very short notice, which (although against the strict rules) the operator kindly did.",2023-09-19,5,,Helpful,,False
Gillian_B,"excellent, enjoying a bit of culture, highly recommend, reasonably priced 
Beautiful church, easy to find a must when in Venice",2023-09-18,5,,Helpful,,False
Ayan_M,"A beautiful concert and tribute to Vivaldi. One of the best live performances you can see in Venice in a beautiful venue. Don’t miss it, worth every cent!",2023-09-18,5,,Helpful,,False
