Reviewer_Name,Review_Body,Review_Date,Rating,Country,Helpful_Tag,Travel Category,Require_Translate
Dennis_G," Firstly to be in Venice in the church where Vivaldi taught and performed was in itself an immersive experience. Then the Vivaldi compositions played by what I would call Olympian quality musicians, blew our minds. Vivaldi continues to impact visitors as the audience was honored with two encores. Step back in time here for an unforgettable visit.",2023-09-12,5,,Helpful,,False
Marc_R,"Great show. Great location. Cool to hear Quattro Stagione in the very church where Vivaldi worked. Excellent acoustics! It was hot as heck but the info flyer was a useful fan!  Crowd loved the show! (as evidenced by the loud clapping, even between movements 😳) 
Would highly recommend this experience",2023-09-11,5,,Helpful,,False
Barbara_C,The acoustics in the church were amazing.  A great performance.  It was the highlight of our trip to Venice,2023-09-06,5,,Helpful,,False
Susan_K,"The concert was much shorter then I expected.  The 4 Seasons performance was fine, but the intro lacked substance",2023-09-05,2,,Helpful,,False
Gabriel_P,"Brilliant setup, music and performance.
I can not recommend it enough. A must when in Venice. Well done",2023-09-02,5,,Helpful,,False
Lauren_K,"Everything was great! But nobody warned us no AC in the building, it was brutal and sold out show so everyone was fanning themselves. We didn’t bring a fan so we used the program (as many others did) to love some air",2023-08-27,4,,Helpful,,False
Suzanne_S,This was a life changing experience for music lovers and those who appreciate the classics.  Please go !,2023-08-24,5,,Helpful,,False
robert_b,The church was beautiful with the music playing also made it more beautiful . The musicians were so talented,2023-08-10,5,,Helpful,,False
alan_b,"Virtuosi Italiani is a fitting name for this ensemble. Their performance was absolutely breathtaking. Without a doubt one of the top highlights of Venice. They did justice to the Four Seasons by Anthonio Vivaldi, and better still at the Vivaldi church itself. It was a journey not only through the four seasons, but also through time. Highly recommended.",2023-08-10,5,,Helpful,,False
chantal_F,"En sortant du concert ds cette belle église ,mon fils (17 ana)et mon conjoint ont dit que c’était leur plus belle chose à Venise😀
(et on n’est pas des musiciens)
Le son et les musiciens étaient merveilleux!",2023-08-08,5,,Helpful,,True
Mara_F,"An absolutely magical experience. The music was so beautiful, and really brought to life by the majesty of the church around us. The best part, however, was the musicians themselves. You could see them smiling at one another— they clearly love the music and love bringing it to others. The concert-master and lead violinist would get so into the piece that he would close his eyes, step away from the sheet music, and play from his soul. It was so moving to watch, and if we come back to Venice, we will absolutely attend another concert at this venue.",2023-08-05,5,,Helpful,,False
Ana_M,"The talented artists, the beautiful church as background.
It was easy to redeem the tickets at the church.",2023-08-01,5,,Helpful,,False
Erika_F,"Thoroughly enjoyed the concert, a highlight of our trip, for sure! The extra cost for the front seats was worth it. Our daughters, ages 10 and 7, said it was “amazing” and couldn’t take their eyes off of the violinists’ fingers. We heard Four Seasons in Prague before, but this performance was better. Experiencing the music in the Vivaldi church was so special. Years from now when we recall our first family trip to Venice, I’m sure this will be a memory that comes easily.",2023-07-30,5,,Helpful,,False
Ronit_S,Loved the experience of seeing Four Seasons in the Vivaldi Church in Venice. I would highly recommend it!  The musicians were top notch. It was definitely one of the highlights of our time in Venice.,2023-07-29,5,,Helpful,,False
Marlowe_E,This is absolutely incredible! Do not miss it! Beautiful energy hearing Vivaldi in Vivaldi’s church. Lead violinist and talented ensemble got standing ovation.,2023-07-27,5,,Helpful,,False
Cheryl_L,The musicians are gifted and provided a wonderful evening in a historic setting. It was great to hear Vivaldi in the church where he taught and wrote much of his music.,2023-07-25,5,,Helpful,,False
Steve_V,"Incredible performance. The venue was amazing and convenient from St. Mark's Square. Spend the extra and sit up front, although there really is not a bad seat.",2023-07-23,5,,Helpful,,False
Linda_H,"Beautiful music and wonderful ambiance.  It was a bit hot in the church as we were there during a heat wave, but the concert was well worth it.",2023-07-21,5,,Helpful,,False
Heather_C,"Really wonderful experience. Yes, it's hot - so bring a fan, but don't let it keep you from this if you are interested in hearing Vivaldi's composition in the place it originated. It's the perfect amount of time with an intro and then the Four Seasons. These are very talented musicians and the church is beautiful and right next to San Marco square. You get your seats assigned when you show your Viator voucher, so you might want to go pick up your tickets early, and then get a drink right next to the church (on the water) before you come back for the performance.",2023-07-20,5,,Helpful,,False
Carolyn_h,"This was a lovely concert. About an hour and 15 minutes, which was perfect. The musicians were wonderful, particularly the lead violinist, who was incredibly passionate, even though I’m sure he has played this music so many times in his life. Yes it was hot, so bring your fan. The church is beautiful and right on the lagoon.",2023-07-20,5,,Helpful,,False
rebekah_s,Loved this concert. Very talented musicians. Venue was beautiful. My husband and I both enjoyed this concert.,2023-07-18,5,,Helpful,,False
Steven_C,Outstanding musicians playing a wonderful piece. The setting was magical as well. My teen son was so impressed by the music and thanked me repeatedly for taking him.,2023-07-15,5,,Helpful,,False
Andrew_W,"This concert was simply amazing. The quality of the musicians, the intimacy of the venue and the church having the acoustics of a concert hall made for a sublime evening!",2023-07-13,5,,Helpful,,False
Eva_B,"I thought this might be a bit touristy, but it was genuinely outstanding music in a beautiful historic music. No gimmicks, the music spoke for itself. Highly recommend.",2023-07-10,5,,Helpful,,False
Albert_I,Brilliant concert with excellent group that played with skill and enthusiasm. The venue is really beautiful.,2023-07-09,5,,Helpful,,False
MaryBeth_F,Even better than we hoped for! This is an outstanding experience that shouldn’t be missed. We only had a short time in Venice and I’m so glad we booked this. Do yourself a favor and pay the extra for the front preference seating. You won’t regret it!,2023-07-09,5,,Helpful,,False
Brian_G,A top trip highlight on our vacation to Italy! The musicians were phenomenal and the historic building so magnificent with its amazing acoustics. It was so beautiful and moving as one could feel the presence of Vivaldi.,2023-07-08,5,,Helpful,,False
jmac22,Excellent performance by very talented and passionate classical musicians. We spoke to other attendees after the concert and they loved the performance too.,2023-07-08,5,,Helpful,,False
Meral_A,"Musicians and the acoustic of the church.  Es war eine belebender,  faszinierender Musikabend. Die Meister haben uns traeumen lassen.",2023-07-08,5,,Helpful,,True
Jen_F,Amazing experience watching incredibly talented musicians bring Vivaldi’s music to life! A must do in Venice!,2023-07-03,5,,Helpful,,False
Elaine_M,"The musicians were incredible, and the soloist did use any sheet music! The venue was the perfect setting to enjoy the pieces of classical music played. The audience remained seated after the concert ended, and so they played a few extra pieces. A wonderful experience for a first-time visitor to Venice (although I would see it again).
The venue was quite warm (July) so recommend taking a hand held fan to keep cool.",2023-07-02,5,,Helpful,,False
Amy_N,The church is very warm in the summertime. Bring a fan. But the music was wonderful & it was a great experience.,2023-06-24,5,,Helpful,,False
Vishal_M,The event was amazing and we really enjoyed our seats. The directions were confusing for a few of us so we got a little turned around.,2023-06-21,5,,Helpful,,False
Kendra_M,"Absolutely amazing 
No fault at all....buy.. it's too hot.
It was 30 degrees outside and the church was stifling...my aunt who was 75 was really suffering...get some air conditioning units...it was unbearable...the recital was amazing...even the lead violinist was struggling with the heat in the church...I have read previous review that comment on the heat....please get it resolved.",2023-06-21,4,,Helpful,,False
Terrie_M,Beautiful music and very talented musicians.  Great evening in a great venue.  It is warm in the church so dress accordingly (June).,2023-06-20,5,,Helpful,,False
Katja_S,Buchung ging schnell und unkompliziert und die Tickets gab es vor Ort in der Kirche. Ein sehr schönes kleines Konzert mit einem wunderschönen Klang in der Kirche. Perfekt um ein Venedigaufenthalt abzurunden.,2023-06-20,5,,Helpful,,True
tajinder_s,beautiful concert with so much talent and in a beautiful church. im traveling solo so i just didn’t like how my seat was taken and they didn’t ask anyone to move so i had to sit in a different row where peoples heads were in the way. i feel like if i paid for a seat i should be able to sit there. besides this minor issue i would recommend this concert and get there early so your seat is available! esp if you’re a solo traveler,2023-06-13,5,,Helpful,,False
Amy_T,This was our very first activity in Venice the day we arrived to Italy for the first time. It was AMAZING! If you enjoy classical music or Vivaldi at all you should go! It was six exceptional musicians playing through the Vivaldi seasons in a smaller chapel right on the sea walkway. You have an assigned seat and tickets are right there at will-call for you. I would arrive at least 15 minutes early as chapel was fairly full by then. There are many dining options nearby but more expensive as they are on the water/near St. Mark's. No food/drink is allowed inside. It was enchanting in every way.,2023-06-12,5,,Helpful,,False
Joann_W,The music was very emotional! They did such a wonderful job. We even clapped and had a standing ovation.,2023-06-11,5,,Helpful,,False
Alice_N,The conductor/1st Violin and his group were perfection. My young teen granddaughter was with me and we enjoyed every minute.,2023-06-10,5,,Helpful,,False
Melanie_C,From the moment we walked into the church it felt like we had stepped back in time. The Four Seasons Concert in the Vivaldi Church (Venice) was one of our stops that I would do again and recommend to family/friends visiting Venice! The music was easy to follow and relaxing. It felt like you were disconnected from the World and traveling through a different era. The Church was a beautiful setting! The whole experience was almost magical!,2023-06-09,5,,Helpful,,False
Iain_L,"Neither of us are particularly into classical music, but wanted to soak in some culture! Lovely evening, beautiful surroundings and music was amazing. Would recommend 😃",2023-06-07,5,,Helpful,,False
Louise_B,Fabulous experience even husband who's not a classical music fan enjoyed it. The musicians were clearly enjoying themselves and they gave wonderful renditions.,2023-06-06,5,,Helpful,,False
Mark_W,The music was amazing! Well done! We are totally transported into the heart of Vivaldi’s “Venice”.  It was incredible.,2023-06-05,5,,Helpful,,False
Julie_G,This was an unforgettable experience!  Definitely pay the extra price for the premium seats. The musicians wer phenomenal - clearly loved and are passionate about their music. To be in the original Vivaldi Church was another plus - only down side is no air conditioning. The time was nice - not too late of a start like other concerts. Also perfect location. Definitely add this to your list of things to do in Venice.,2023-06-05,5,,Helpful,,False
Diane_S,The quality of the performance along with the change of lighting inside the building made for a magical evening,2023-06-03,5,,Helpful,,False
Sylvia_A,A true highlight of our trip — Vivaldi expertly and passionately performed in a historic church.  It was magical:,2023-06-03,5,,Helpful,,False
Jennifer_S,"The guide, Alessandro, was superb. He took care of the guests. There was a person in the tour who recently had back surgery, and Allesandro took care to make sure she was accommodated. The pacing was perfect for young and older adults, children, and teens. The tour was everything that was promised, and we were able to see all of the major attractions without standing in long lines.",2023-06-03,5,,Helpful,,False
Alka_G,"Hi, It was very easy to book the ticket. The event was in a lovely small church which is quite easy to find. A quick change of voucher to ticket and we were directed to our seats. The concert started on time and it was a GREAT experience. The musicians were very talented and it appeared that they enjoyed performing and entertaining us. They appeared to take great pride and delight in the music they were playing. Even my teen enjoyed it. Make on to a must do in Venice list.",2023-06-01,5,,Helpful,,False
Felicia_M,It was incredible. Excelent perfomance. Great location. A unique experience at Venice. I truly reccomend.,2023-05-30,5,,Helpful,,False
Klaus_E,"Kirche mit beeindruckender Akustik, daher ausreichende Tonfülle trotz des kleinen Ensembles. Allerdings ein wenig hastig gespielt, als hätten die Musiker den Feierabend herbei gesehnt. Trotzdem sehr zu empfehlen.",2023-05-23,5,,Helpful,,True
Petar_S,Excellent performance in a beautiful church. Get the prestige tickets. You will be seated at the first two rows.,2023-05-23,5,,Helpful,,False
Christine_G,Didnt know what to expect but it was a beautiful setting for a lovely concert with very accomplished musicians.,2023-05-22,5,,Helpful,,False
Peter_A,"TheVivaldi concert is an outstanding experience.  The music, the setting, every aspect is unique and creates a very special experience never to be forgotten.",2023-05-18,5,,Helpful,,False
don_j,"Sitting so close to musicians in the wonderful setting of the Peta.  
It wonderful introduction to Venice and Vilvaldi for my Mother in law",2023-05-09,5,,Helpful,,False
Alan_W,"A wonderful recital in a truly remarkable setting. 
The ""Vivaldi"" Church, near Piazza San Marco, is an awe inspiring venue with perfect acoustics for the seven piece string group.",2023-05-08,5,,Helpful,,False
JOSELUIS_B,"Excelentes músicos y un repertorio impecable. La acústica de la iglesia es inmejorable. Recomiendo conseguir con antelación las entradas, por la mañana previa al menos.",2023-05-08,5,,Helpful,,True
Athena_E,"This concert was excellent. Not just the ambience inside a wonderful church, but the music, the virtuosity and intimacy, was worth a lifetime of memories",2023-05-05,5,,Helpful,,False
Peter_B,It was amazing to hear this music brought to life in such a historic location. The musicians were excellent and brought enthusiasm to the performance.,2023-04-26,5,,Helpful,,False
Martina_M,"Super Organisation. Nummerierte Sitzplätze. Die Musiker waren fantastisch. 
Ein unvergessliches Konzert.",2023-04-22,5,,Helpful,,True
Sian_O,Wonderful concert in a beautiful church!  The group was connected and engaging with each other and the audience.,2023-04-17,5,,Helpful,,False
Karen_S,"Fantastic concert.  Can't get much better than to listen to Vivaldi while in a beautiful church in Venice.  The musicians were outstanding and made you ""feel"" the music.  Wonderful way to regroup from hustle and bustle that is Venice.",2023-04-13,5,,Helpful,,False
Stella_A,"Firstly, we had terrible trouble trying to depend on Google Maps to get us to the church, because the satellite GPS is slow and did not show us that there were construction works blocking the suggested route.  Once we actilually arrived (after walking about 35 minutes very fast), the staff were most polite and helpful, making us wait (understandably) at the back of the church until there was a break in the music. This gave us a chance to regain our breaths discreetly. Once we had settled in to our seats, the experience was absolutely sensational.  The maestro (Alberto Martin) directed his little group effortlessly and with original interpretation of the well-known music, in a most refreshing and compelling way.  The players are all most accomplished experts, well balanced and harmonious. We really enjoyed it very much indeed, despite our hasty and disorganised arrival. We were treated respectfully and kindly by the staff at the church, whose interior is typically Venetian and beautiful.",2023-04-04,5,,Helpful,,False
